row_type,brand_slug,brand_name,brand_name_ko,status,brand_category,brand_summary,brand_description,brand_accent,brand_image,store_url,product_model,product_name,product_summary,product_image,product_tags
product,lootun,LOOTUN,루툰,판매중,캐릭터 무드등,일상에 작은 휴식과 분위기를 더하는 캐릭터 무드등 브랜드,말랑한 실루엣과 부드러운 빛으로 침실과 책상 위를 편안하게 채우는 선물용 무드등 브랜드입니다.,#e7b13f,assets/images/lootun-catalog-hero.png,https://smartstore.naver.com/teamz,LT-001,말랑 뮤지컬 오리 무드등,포근한 빛으로 지친 하루를 쉬게 해주는 오리 무드등,assets/images/products/lt-001/thumbnail-01.jpg,무드등|선물|캐릭터
product,lootun,LOOTUN,루툰,판매중,캐릭터 무드등,일상에 작은 휴식과 분위기를 더하는 캐릭터 무드등 브랜드,말랑한 실루엣과 부드러운 빛으로 침실과 책상 위를 편안하게 채우는 선물용 무드등 브랜드입니다.,#e7b13f,assets/images/lootun-catalog-hero.png,https://smartstore.naver.com/teamz,LT-002,말랑 축구공 무드등,스포츠 감성을 담은 말랑한 충전식 무드등,assets/images/products/lt-002/thumbnail-01.jpg,무드등|축구|충전식
product,lootun,LOOTUN,루툰,판매중,캐릭터 무드등,일상에 작은 휴식과 분위기를 더하는 캐릭터 무드등 브랜드,말랑한 실루엣과 부드러운 빛으로 침실과 책상 위를 편안하게 채우는 선물용 무드등 브랜드입니다.,#e7b13f,assets/images/lootun-catalog-hero.png,https://smartstore.naver.com/teamz,LT-003,말랑 토끼 무드등,잠자리 곁을 부드럽게 밝혀주는 토끼 무드등,assets/images/products/lt-003/thumbnail-01.jpg,무드등|토끼|침실
brand,uandi,U&I,유앤아이,준비중,생활용품,실용적인 생활용품과 시즌 상품을 정리하는 데일리 브랜드,판매 채널과 상품군 확장에 맞춰 대표 상품을 순차적으로 공개할 예정입니다.,#2f7d77,,,,,,
brand,xord-select,XORD Select,엑소드 셀렉트,큐레이션,브랜드 셀렉션,브랜드별 대표 상품과 테스트 상품을 모아 보여주는 셀렉션,신규 상품 검토와 상세페이지 준비 및 채널별 판매 상태를 한곳에서 관리합니다.,#c95f4b,,,,,,
